linked_public_doc,internal_date,public_date,gap_days,internal_event_type,internal_aspect,final_internal_sentiment,final_public_sentiment,finbert_score,sentiment_gap_score,narrative_gap_flag,risk_score,public_headline,internal_text,advisory_output
news_002154,2018-07-06 08:31:00,2018-07-11 08:31:00,5,EARNINGS,revenue_growth,positive,negative,0.6005925536155701,2,1,18,"Not even strong earnings can prevent a 10 percent plunge, top Invesco market watcher warns","Based on internal discussion, Expectations internally seem stronger than public coverage suggests. Worth monitoring.",Internal discussion shows positive sentiment regarding EARNINGS 5 day(s) before public reporting remains negative.
news_011688,2019-03-26 00:00:00,2019-03-31 00:00:00,5,FORECAST,general,positive,negative,0.8920667171478271,2,1,18,Business leader Raft of woeful forecasts spells an end to Trump’s economic bragging rights,The current internal view is that Discussion suggests expectations are more positive than public commentary.,Internal discussion shows positive sentiment regarding FORECAST 5 day(s) before public reporting remains negative.
news_032556,2019-10-13 00:00:00,2019-10-18 00:00:00,5,EARNINGS,timing,positive,negative,0.9747374653816223,2,1,18,"Holiday Inn-owner IHG hit by weak China, Hong Kong bookings","Based on internal discussion, Expectations internally seem stronger than public coverage suggests. Worth monitoring.",Internal discussion shows positive sentiment regarding EARNINGS 5 day(s) before public reporting remains negative.
news_032142,2019-10-24 00:00:00,2019-10-29 00:00:00,5,EARNINGS,timing,positive,negative,0.9465169906616211,2,1,18,"Merck to ramp up Gardasil vaccine production, flags 'tempered' sales growth in 2020","From the tone of recent messages, Internal tone suggests confidence around the next results cycle. Could be important.",Internal discussion shows positive sentiment regarding EARNINGS 5 day(s) before public reporting remains negative.
news_019028,2018-02-26 00:00:00,2018-03-03 00:00:00,5,REGULATORY,regulatory,negative,neutral,0.48636192083358765,-1,1,16,Commerce secretary says it is 'no big deal' that Trump's tariffs will add $175 to price of car,"Based on internal discussion, There is concern internally that this could draw more scrutiny.","Internal discussion raises regulatory concern ahead of public reporting. Internal sentiment is negative, appearing 5 day(s) earlier than external coverage."
news_053020,2018-03-17 00:00:00,2018-03-22 00:00:00,5,EARNINGS,revenue_growth,positive,neutral,0.6295982003211975,1,1,16,BMW says electric car mass production not viable until 2020,Team comments suggest that There seems to be positive momentum around performance expectations. This may matter soon.,Internal discussion shows positive sentiment regarding EARNINGS 5 day(s) before public reporting remains neutral.
news_049449,2018-06-17 00:00:00,2018-06-22 00:00:00,5,PARTNERSHIP,timing,positive,negative,0.9686276316642761,2,1,16,Exclusive: Tesla to close a dozen solar facilities in nine states - documents,Internal sentiment indicates that The internal view seems more positive than the public framing. Could be important.,Internal discussion shows positive sentiment regarding PARTNERSHIP 5 day(s) before public reporting remains negative.
news_015449,2018-09-05 00:00:00,2018-09-10 00:00:00,5,IPO,general,positive,negative,0.8002830743789673,2,1,16,Masked gunmen attack Libyan oil corporation HQ in Tripoli,The current internal view is that Internal discussion suggests confidence around the listing process. Worth monitoring.,Internal discussion shows positive sentiment regarding IPO 5 day(s) before public reporting remains negative.
news_001866,2018-10-07 19:06:00,2018-10-12 19:06:00,5,PARTNERSHIP,revenue_growth,positive,negative,0.6424553394317627,2,1,16,"Cannabis could disrupt a $500 billion market, says CEO of top marijuana maker after deal with DEA",Internal tone is more confident around the agreement.,Internal discussion shows positive sentiment regarding PARTNERSHIP 5 day(s) before public reporting remains negative.
news_013730,2018-11-30 00:00:00,2018-12-05 00:00:00,5,PARTNERSHIP,strategic_event,positive,negative,0.8513438105583191,2,1,16,No-deal Brexit fears prompt UK economy to flatline,"Based on internal discussion, There seems to be stronger belief in the strategic value of this deal. Worth monitoring.",Internal discussion shows positive sentiment regarding PARTNERSHIP 5 day(s) before public reporting remains negative.
news_043098,2019-01-05 00:00:00,2019-01-10 00:00:00,5,EARNINGS,revenue_growth,positive,neutral,0.884297251701355,1,1,16,Starboard building stake in MGM Resorts: sources,Team comments suggest that Internal tone suggests confidence around the next results cycle. Worth monitoring.,Internal discussion shows positive sentiment regarding EARNINGS 5 day(s) before public reporting remains neutral.
news_037230,2019-06-01 00:00:00,2019-06-06 00:00:00,5,M&A,regulatory,positive,neutral,0.852591872215271,1,1,16,Three states join AG group probing planned merger of Sprint and T-Mobile,Internal sentiment indicates that Looks like this deal is likely to move ahead. Could be important.,Internal discussion shows positive sentiment regarding M&A 5 day(s) before public reporting remains neutral.
news_032290,2019-10-20 00:00:00,2019-10-25 00:00:00,5,REGULATORY,regulatory,negative,neutral,0.5052158236503601,-1,1,16,Exclusive: China's WeWork equivalent Ucommune files for U.S. IPO - sources,"From the tone of recent messages, There seems to be concern that this issue may escalate. Could be important.","Internal discussion raises regulatory concern ahead of public reporting. Internal sentiment is negative, appearing 5 day(s) earlier than external coverage."
news_030516,2019-11-30 00:00:00,2019-12-05 00:00:00,5,PARTNERSHIP,strategic_event,positive,negative,0.8996222615242004,2,1,16,UK's Javid: chances of ending Brexit transition without EU trade deal are remote,"From the tone of recent messages, Discussion suggests the partnership could be more meaningful than reported. Could be important.",Internal discussion shows positive sentiment regarding PARTNERSHIP 5 day(s) before public reporting remains negative.
news_052836,2018-03-22 00:00:00,2018-03-26 00:00:00,4,M&A,strategic_event,positive,negative,0.837054431438446,2,1,16,DISH executive testifies against planned AT&T merger with Time Warner,Team comments suggest that Internal discussion suggests the merger is progressing well.,Internal discussion shows positive sentiment regarding M&A 4 day(s) before public reporting remains negative.
news_002423,2018-04-09 19:42:00,2018-04-13 19:42:00,4,EARNINGS,valuation,positive,negative,0.7750274538993835,2,1,16,Cramer's game plan: Washington headwinds could overwhelm earnings,Expectations internally seem stronger than public coverage suggests. Keep an eye on this.,Internal discussion shows positive sentiment regarding EARNINGS 4 day(s) before public reporting remains negative.
news_051819,2018-04-16 00:00:00,2018-04-20 00:00:00,4,EARNINGS,valuation,positive,negative,0.9758435487747192,2,1,16,"Schlumberger profit barely tops Street, says oil market balanced",Discussion points to a stronger earnings outcome than expected. Keep an eye on this.,Internal discussion shows positive sentiment regarding EARNINGS 4 day(s) before public reporting remains negative.
news_051217,2018-05-03 00:00:00,2018-05-07 00:00:00,4,EARNINGS,revenue_growth,positive,negative,0.5479633212089539,2,1,16,ValueAct takes $1.2 billion stake in Citigroup: letter,Internal sentiment indicates that Expectations internally seem stronger than public coverage suggests. This may matter soon.,Internal discussion shows positive sentiment regarding EARNINGS 4 day(s) before public reporting remains negative.
news_040459,2019-03-11 00:00:00,2019-03-15 00:00:00,4,EARNINGS,revenue_growth,positive,negative,0.9261343479156494,2,1,16,Volkswagen supervisory board condemns CEO's 'EBIT macht frei' remark,Team comments suggest that There seems to be positive momentum around performance expectations. Worth monitoring.,Internal discussion shows positive sentiment regarding EARNINGS 4 day(s) before public reporting remains negative.
news_038345,2019-05-04 00:00:00,2019-05-08 00:00:00,4,EARNINGS,valuation,positive,negative,0.9748245477676392,2,1,16,"Intel shares drop, three-year outlook seen lagging rivals",Internal sentiment indicates that There seems to be positive momentum around performance expectations. Keep an eye on this.,Internal discussion shows positive sentiment regarding EARNINGS 4 day(s) before public reporting remains negative.
news_030838,2019-11-22 00:00:00,2019-11-26 00:00:00,4,EARNINGS,valuation,positive,negative,0.9752770066261292,2,1,16,Dollar Tree forecast misses as tariffs bite; shares slump 17%,"From the tone of recent messages, Discussion points to a stronger earnings outcome than expected. Keep an eye on this.",Internal discussion shows positive sentiment regarding EARNINGS 4 day(s) before public reporting remains negative.
news_028319,2020-02-03 00:00:00,2020-02-07 00:00:00,4,EARNINGS,timing,positive,negative,0.9718316793441772,2,1,16,Majority of U.S. firms in China see revenue hit from coronavirus: AmCham survey,"From the tone of recent messages, Internal tone suggests confidence around the next results cycle. This may matter soon.",Internal discussion shows positive sentiment regarding EARNINGS 4 day(s) before public reporting remains negative.
news_019383,2018-02-09 00:00:00,2018-02-14 00:00:00,5,PARTNERSHIP,strategic_event,positive,neutral,0.8478918075561523,1,1,14,Resist a US trade deal. Your life may depend on it,"Based on internal discussion, The internal view seems more positive than the public framing. Flag for review.",Internal discussion shows positive sentiment regarding PARTNERSHIP 5 day(s) before public reporting remains neutral.
news_048271,2018-07-23 00:00:00,2018-07-27 00:00:00,4,FORECAST,general,positive,neutral,0.8699613213539124,1,1,14,Mastercard reiterates FY expenses outlook,The current internal view is that Discussion suggests expectations are more positive than public commentary. Could be important.,Internal discussion shows positive sentiment regarding FORECAST 4 day(s) before public reporting remains neutral.
news_047681,2018-08-12 00:00:00,2018-08-16 00:00:00,4,REGULATORY,regulatory,negative,neutral,0.8992086052894592,-1,1,14,SEC pressing Tesla directors for details on communications with Musk: Wall Street Journal,Team appears cautious about the investigation risk here. Keep an eye on this.,"Internal discussion raises regulatory concern ahead of public reporting. Internal sentiment is negative, appearing 4 day(s) earlier than external coverage."
news_034185,2019-09-05 00:00:00,2019-09-09 00:00:00,4,REGULATORY,regulatory,negative,neutral,0.6667063236236572,-1,1,14,U.S. House panel to review DOJ automaker antitrust probe,Internal tone points to elevated compliance sensitivity. Worth monitoring.,"Internal discussion raises regulatory concern ahead of public reporting. Internal sentiment is negative, appearing 4 day(s) earlier than external coverage."
news_029301,2020-01-11 00:00:00,2020-01-15 00:00:00,4,PARTNERSHIP,strategic_event,positive,negative,0.9420067667961121,2,1,14,China's 'market condition' caveat on U.S. ag purchases adds to trade deal doubts,There seems to be stronger belief in the strategic value of this deal. Worth monitoring.,Internal discussion shows positive sentiment regarding PARTNERSHIP 4 day(s) before public reporting remains negative.
news_019387,2018-02-11 00:00:00,2018-02-14 00:00:00,3,EARNINGS,revenue_growth,positive,negative,0.8365848064422607,2,1,14,Myer chief Richard Umbers quits after third profit warning,Internal sentiment indicates that There seems to be positive momentum around performance expectations. This may matter soon.,Internal discussion shows positive sentiment regarding EARNINGS 3 day(s) before public reporting remains negative.
news_048043,2018-07-31 00:00:00,2018-08-03 00:00:00,3,EARNINGS,valuation,positive,negative,0.972788393497467,2,1,14,AIG shares slide 3 percent after executives downplay weak results,Team comments suggest that There seems to be positive momentum around performance expectations. This may matter soon.,Internal discussion shows positive sentiment regarding EARNINGS 3 day(s) before public reporting remains negative.
news_001549,2019-01-21 12:04:00,2019-01-24 12:04:00,3,EARNINGS,valuation,positive,negative,0.9658132791519165,2,1,14,Credit Suisse strategist shares his top concern about current market conditions,"Based on internal discussion, There seems to be positive momentum around performance expectations. This may matter soon.",Internal discussion shows positive sentiment regarding EARNINGS 3 day(s) before public reporting remains negative.
news_016781,2018-06-24 00:00:00,2018-06-27 00:00:00,3,PARTNERSHIP,strategic_event,positive,negative,0.533552885055542,2,1,12,"Brexit: bank contracts worth trillions at risk, says finance watchdog","From the tone of recent messages, There seems to be stronger belief in the strategic value of this deal.",Internal discussion shows positive sentiment regarding PARTNERSHIP 3 day(s) before public reporting remains negative.
news_044054,2018-12-03 00:00:00,2018-12-06 00:00:00,3,REGULATORY,regulatory,negative,neutral,0.6715026497840881,-1,1,12,J&J unit to pay $360 million to U.S. to resolve charity kickback probe,"From the tone of recent messages, Internal tone points to elevated compliance sensitivity. Flag for review.","Internal discussion raises regulatory concern ahead of public reporting. Internal sentiment is negative, appearing 3 day(s) earlier than external coverage."
news_040618,2019-03-10 00:00:00,2019-03-13 00:00:00,3,IPO,timing,positive,negative,0.9624366164207458,2,1,12,VW halts truck unit IPO until market conditions improve,Internal sentiment indicates that Internal discussion suggests confidence around the listing process.,Internal discussion shows positive sentiment regarding IPO 3 day(s) before public reporting remains negative.
news_011823,2019-03-21 00:00:00,2019-03-24 00:00:00,3,M&A,regulatory,positive,neutral,0.8611858487129211,1,1,12,Sainsbury's and Asda offer to sell up to 150 stores to secure merger,There seems to be growing confidence around the deal. Flag for review.,Internal discussion shows positive sentiment regarding M&A 3 day(s) before public reporting remains neutral.
news_037382,2019-06-01 00:00:00,2019-06-04 00:00:00,3,REGULATORY,regulatory,negative,neutral,0.8111792802810669,-1,1,12,U.S. moving toward major antitrust probe of tech giants,Discussion suggests the regulatory angle may become more serious. Could be important.,"Internal discussion raises regulatory concern ahead of public reporting. Internal sentiment is negative, appearing 3 day(s) earlier than external coverage."
news_009908,2019-07-08 00:00:00,2019-07-11 00:00:00,3,PARTNERSHIP,strategic_event,positive,negative,0.9528341293334961,2,1,12,Bank of England warns no-deal Brexit could trigger economic shock,"Based on internal discussion, Discussion suggests the partnership could be more meaningful than reported. Keep an eye on this.",Internal discussion shows positive sentiment regarding PARTNERSHIP 3 day(s) before public reporting remains negative.
news_035244,2019-08-03 00:00:00,2019-08-06 00:00:00,3,M&A,strategic_event,positive,neutral,0.500293493270874,1,1,12,"Snap to raise $1 billion to invest in AR, possible acquisitions",Team comments suggest that Team seems confident the acquisition will go through. Could be important.,Internal discussion shows positive sentiment regarding M&A 3 day(s) before public reporting remains neutral.
news_000689,2019-11-22 11:23:00,2019-11-25 11:23:00,3,M&A,valuation,positive,neutral,0.8921661376953125,1,1,12,"Everything Jim Cramer said on 'Mad Money,' including Schwab-TD Ameritrade talks, weed stocks",Team comments suggest that Team seems confident the acquisition will go through. Could be important.,Internal discussion shows positive sentiment regarding M&A 3 day(s) before public reporting remains neutral.
news_027509,2020-02-24 00:00:00,2020-02-27 00:00:00,3,PARTNERSHIP,strategic_event,positive,negative,0.9718019366264343,2,1,12,Mexico's state-run Pemex posts steep 2019 loss in blow to president's revival plan,Discussion suggests the partnership could be more meaningful than reported. Worth monitoring.,Internal discussion shows positive sentiment regarding PARTNERSHIP 3 day(s) before public reporting remains negative.
news_024574,2020-04-17 00:00:00,2020-04-20 00:00:00,3,PARTNERSHIP,strategic_event,positive,negative,0.9729702472686768,2,1,12,Wall Street drops as oil traders cannot give away U.S. crude,"Based on internal discussion, Internal tone is more confident around the agreement. This may matter soon.",Internal discussion shows positive sentiment regarding PARTNERSHIP 3 day(s) before public reporting remains negative.
news_024396,2020-04-19 00:00:00,2020-04-22 00:00:00,3,PARTNERSHIP,strategic_event,positive,negative,0.9445794820785522,2,1,12,Exclusive: Two SpiceJet lessors in talks to reclaim planes over missed payments - sources,The current internal view is that There seems to be stronger belief in the strategic value of this deal. Flag for review.,Internal discussion shows positive sentiment regarding PARTNERSHIP 3 day(s) before public reporting remains negative.
news_022511,2020-06-02 00:00:00,2020-06-05 00:00:00,3,M&A,strategic_event,positive,neutral,0.8562777638435364,1,1,12,"LVMH refrains from renegotiating Tiffany deal, sources say",The current internal view is that This transaction could strengthen the position significantly.,Internal discussion shows positive sentiment regarding M&A 3 day(s) before public reporting remains neutral.
news_052120,2018-04-10 00:00:00,2018-04-12 00:00:00,2,M&A,regulatory,positive,negative,0.6352695822715759,2,1,12,"Twelve senators seek FCC probe of Sinclair news scripts, pause in Tribune review",Team comments suggest that There seems to be growing confidence around the deal. This may matter soon.,Internal discussion shows positive sentiment regarding M&A 2 day(s) before public reporting remains negative.
news_047996,2018-08-04 00:00:00,2018-08-06 00:00:00,2,M&A,valuation,positive,negative,0.9716278314590454,2,1,12,Linde shares drop as Praxair merger hits U.S. antitrust hurdle,"Based on internal discussion, This transaction could strengthen the position significantly.",Internal discussion shows positive sentiment regarding M&A 2 day(s) before public reporting remains negative.
news_014704,2018-10-16 00:00:00,2018-10-18 00:00:00,2,EARNINGS,revenue_growth,positive,negative,0.9704039096832275,2,1,12,Flybe profits warning wipes 40% off regional airline's value,Internal sentiment indicates that There seems to be positive momentum around performance expectations. This may matter soon.,Internal discussion shows positive sentiment regarding EARNINGS 2 day(s) before public reporting remains negative.
news_014539,2018-10-24 00:00:00,2018-10-26 00:00:00,2,EARNINGS,revenue_growth,positive,negative,0.9077123999595642,2,1,12,Alphabet reports $33.7bn in revenue as sexual misconduct claims engulf Google,"Based on internal discussion, Expectations internally seem stronger than public coverage suggests. Flag for review.",Internal discussion shows positive sentiment regarding EARNINGS 2 day(s) before public reporting remains negative.
news_031890,2019-10-30 00:00:00,2019-11-01 00:00:00,2,EARNINGS,valuation,positive,negative,0.9762383103370667,2,1,12,Chevron's profit falls due to weaker oil and gas prices,"Based on internal discussion, Team appears confident the results will come in well. Keep an eye on this.",Internal discussion shows positive sentiment regarding EARNINGS 2 day(s) before public reporting remains negative.
news_030837,2019-11-24 00:00:00,2019-11-26 00:00:00,2,FORECAST,revenue_growth,positive,negative,0.9735909700393677,2,1,12,"Abercrombie & Fitch trims forecast as Hollister, international business drag",The current internal view is that Discussion suggests expectations are more positive than public commentary. Could be important.,Internal discussion shows positive sentiment regarding FORECAST 2 day(s) before public reporting remains negative.
news_024576,2020-04-18 00:00:00,2020-04-20 00:00:00,2,FORECAST,revenue_growth,positive,negative,0.9441441893577576,2,1,12,"IBM sees shift in client spend priorities, withdraws annual forecast",Discussion suggests expectations are more positive than public commentary. Worth monitoring.,Internal discussion shows positive sentiment regarding FORECAST 2 day(s) before public reporting remains negative.
news_023852,2020-05-03 00:00:00,2020-05-05 00:00:00,2,EARNINGS,timing,positive,negative,0.9744502902030945,2,1,12,BNP warns of 2020 profit fall as crisis wipes out equity trading,"Based on internal discussion, Discussion points to a stronger earnings outcome than expected.",Internal discussion shows positive sentiment regarding EARNINGS 2 day(s) before public reporting remains negative.
news_012666,2019-01-31 00:00:00,2019-02-03 00:00:00,3,PARTNERSHIP,strategic_event,positive,neutral,0.6242861151695251,1,1,10,Oldies are pampered. We should offer a new deal to the young,"From the tone of recent messages, Discussion suggests the partnership could be more meaningful than reported. Flag for review.",Internal discussion shows positive sentiment regarding PARTNERSHIP 3 day(s) before public reporting remains neutral.
news_012078,2019-03-04 00:00:00,2019-03-07 00:00:00,3,PARTNERSHIP,strategic_event,positive,neutral,0.8388141393661499,1,1,10,How five smaller UK firms are preparing for a no-deal Brexit,Internal sentiment indicates that There seems to be stronger belief in the strategic value of this deal. Flag for review.,Internal discussion shows positive sentiment regarding PARTNERSHIP 3 day(s) before public reporting remains neutral.
news_002517,2018-03-17 19:46:00,2018-03-19 19:46:00,2,EARNINGS,revenue_growth,positive,neutral,0.6191426515579224,1,1,10,Cramer: Etsy is a buy after proving it can stave off Amazon,"From the tone of recent messages, There seems to be positive momentum around performance expectations. Keep an eye on this.",Internal discussion shows positive sentiment regarding EARNINGS 2 day(s) before public reporting remains neutral.
news_049314,2018-06-25 00:00:00,2018-06-27 00:00:00,2,M&A,regulatory,positive,neutral,0.475922554731369,1,1,10,Trump to use U.S. security review panel to curb China tech investments,Internal sentiment indicates that There seems to be growing confidence around the deal. Worth monitoring.,Internal discussion shows positive sentiment regarding M&A 2 day(s) before public reporting remains neutral.
news_041669,2019-02-13 00:00:00,2019-02-15 00:00:00,2,REGULATORY,regulatory,negative,neutral,0.902971625328064,-1,1,10,"Venezuela opposition to leave Citgo funds, management untouched: envoy","Based on internal discussion, There seems to be concern that this issue may escalate. Could be important.","Internal discussion raises regulatory concern ahead of public reporting. Internal sentiment is negative, appearing 2 day(s) earlier than external coverage."
news_000185,2020-04-27 18:48:00,2020-04-29 18:48:00,2,EARNINGS,valuation,positive,neutral,0.9353519678115845,1,1,10,"Jim Cramer reacts to AMD, Starbucks, Boeing, GE and Alphabet earnings reports","Based on internal discussion, Discussion points to a stronger earnings outcome than expected. Flag for review.",Internal discussion shows positive sentiment regarding EARNINGS 2 day(s) before public reporting remains neutral.
news_050702,2018-05-20 00:00:00,2018-05-21 00:00:00,1,EARNINGS,timing,positive,negative,0.9684327244758606,2,1,10,Aston Martin gears up for more growth ahead of possible flotation,"From the tone of recent messages, Team appears confident the results will come in well. Worth monitoring.",Internal discussion shows positive sentiment regarding EARNINGS 1 day(s) before public reporting remains negative.
news_049302,2018-06-27 00:00:00,2018-06-28 00:00:00,1,M&A,strategic_event,positive,negative,0.9251129627227783,2,1,10,Takeda shareholders bin proposal from anti-Shire group; only 10 percent in favor,The current internal view is that Team seems confident the acquisition will go through. Worth monitoring.,Internal discussion shows positive sentiment regarding M&A 1 day(s) before public reporting remains negative.
news_046499,2018-09-25 00:00:00,2018-09-26 00:00:00,1,EARNINGS,revenue_growth,negative,positive,0.9454611539840698,-2,1,10,Lyft revenue more than doubled in first half of 2018: The Information,"From the tone of recent messages, There seems to be positive momentum around performance expectations. This may matter soon.",Internal discussion shows negative sentiment regarding EARNINGS 1 day(s) before public reporting remains positive.
news_046464,2018-09-26 00:00:00,2018-09-27 00:00:00,1,FORECAST,timing,positive,negative,0.9745481014251709,2,1,10,"U.S. capital goods orders, trade data temper third-quarter growth forecasts",There seems to be stronger upside conviction internally. Flag for review.,Internal discussion shows positive sentiment regarding FORECAST 1 day(s) before public reporting remains negative.
news_014868,2018-10-08 00:00:00,2018-10-09 00:00:00,1,FORECAST,revenue_growth,positive,negative,0.9645845293998718,2,1,10,Business live FTSE 100 hits six-month low as IMF slashes growth forecasts - as it happened,The current internal view is that Internal tone points to stronger belief in the forecast. This may matter soon.,Internal discussion shows positive sentiment regarding FORECAST 1 day(s) before public reporting remains negative.
