linked_public_doc,internal_date,public_date,gap_days,internal_event_type,internal_aspect,final_internal_sentiment,final_public_sentiment,finbert_score,sentiment_gap_score,narrative_gap_flag,risk_score,public_headline,internal_text,advisory_output
news_025712,2020-03-29 00:00:00,2020-03-30 00:00:00,1,EARNINGS,regulatory,neutral,negative,0.9481835961341858,1,1,7,U.S. senators scrutinize meat packers' big profits during pandemic,Internal sentiment indicates that Team appears confident the results will come in well. Flag for review.,Internal discussion shows neutral sentiment regarding EARNINGS 1 day(s) before public reporting remains negative.
news_025498,2020-04-01 00:00:00,2020-04-02 00:00:00,1,EARNINGS,revenue_growth,neutral,negative,0.8925261497497559,1,1,7,JPMorgan Chase probably unable to accept small business loan applications Friday: memo,There seems to be positive momentum around performance expectations. Could be important.,Internal discussion shows neutral sentiment regarding EARNINGS 1 day(s) before public reporting remains negative.
news_022994,2020-05-25 00:00:00,2020-05-26 00:00:00,1,REGULATORY,regulatory,neutral,negative,0.873214840888977,1,1,7,COVID-19 lawsuit takes on McDonald's like it was a rowdy bar,Internal sentiment indicates that Discussion suggests the regulatory angle may become more serious. This may matter soon.,"Internal discussion raises regulatory concern ahead of public reporting. Internal sentiment is neutral, appearing 1 day(s) earlier than external coverage."
news_022895,2020-05-27 00:00:00,2020-05-28 00:00:00,1,FORECAST,general,neutral,negative,0.9707403182983398,1,1,7,"EasyJet to cut 4,500 jobs to stay competitive after crisis",There seems to be stronger upside conviction internally. Worth monitoring.,Internal discussion shows neutral sentiment regarding FORECAST 1 day(s) before public reporting remains negative.
news_022256,2020-06-10 00:00:00,2020-06-11 00:00:00,1,FORECAST,timing,neutral,negative,0.9636808633804321,1,1,7,Wall Street plunges to close with biggest one-day loss since March 16,Internal sentiment indicates that Team appears more confident on the outlook than external coverage shows. Worth monitoring.,Internal discussion shows neutral sentiment regarding FORECAST 1 day(s) before public reporting remains negative.
news_021026,2020-07-09 00:00:00,2020-07-10 00:00:00,1,REGULATORY,regulatory,neutral,negative,0.7803074717521667,1,1,7,"EU regulators to decide by July 31 on Alstom, Bombardier deal","From the tone of recent messages, Internal tone points to elevated compliance sensitivity.","Internal discussion raises regulatory concern ahead of public reporting. Internal sentiment is neutral, appearing 1 day(s) earlier than external coverage."
news_047733,2018-08-14 00:00:00,2018-08-15 00:00:00,1,PARTNERSHIP,strategic_event,positive,neutral,0.9015777111053467,1,1,6,"Musk bid for Tesla: no formal offer, no firm deals with advisers",The current internal view is that Internal tone is more confident around the agreement. Flag for review.,Internal discussion shows positive sentiment regarding PARTNERSHIP 1 day(s) before public reporting remains neutral.
news_045815,2018-10-16 00:00:00,2018-10-17 00:00:00,1,PARTNERSHIP,strategic_event,positive,neutral,0.7491405606269836,1,1,6,Appeals court to hear U.S. Justice Department objection to AT&T deal on Dec. 6,Internal sentiment indicates that There seems to be stronger belief in the strategic value of this deal. Keep an eye on this.,Internal discussion shows positive sentiment regarding PARTNERSHIP 1 day(s) before public reporting remains neutral.
news_045489,2018-10-25 00:00:00,2018-10-26 00:00:00,1,IPO,timing,positive,neutral,0.7151982188224792,1,1,6,Volkswagen has held kick-off meeting for 2019 Traton IPO: sources,"From the tone of recent messages, Internal discussion suggests confidence around the listing process. Could be important.",Internal discussion shows positive sentiment regarding IPO 1 day(s) before public reporting remains neutral.
news_008084,2019-10-20 00:00:00,2019-10-21 00:00:00,1,PARTNERSHIP,strategic_event,positive,neutral,0.649013876914978,1,1,6,The Guardian view on deadlock in parliament: still time to thwart Johnson’s reckless deal,"Based on internal discussion, The internal view seems more positive than the public framing. This may matter soon.",Internal discussion shows positive sentiment regarding PARTNERSHIP 1 day(s) before public reporting remains neutral.
news_020223,2018-01-08 00:00:00,2018-01-09 00:00:00,1,PARTNERSHIP,strategic_event,neutral,negative,0.9361271262168884,1,1,5,Jared Kushner's company under renewed scrutiny over Chinese and Israeli deals,"From the tone of recent messages, Internal tone is more confident around the agreement.",Internal discussion shows neutral sentiment regarding PARTNERSHIP 1 day(s) before public reporting remains negative.
news_052590,2018-04-01 00:00:00,2018-04-02 00:00:00,1,PARTNERSHIP,strategic_event,neutral,negative,0.8957746624946594,1,1,5,U.S. fights AT&T deal by citing Time Warner's clout with cable companies,Team comments suggest that Internal tone is more confident around the agreement. This may matter soon.,Internal discussion shows neutral sentiment regarding PARTNERSHIP 1 day(s) before public reporting remains negative.
news_051861,2018-04-18 00:00:00,2018-04-19 00:00:00,1,PARTNERSHIP,strategic_event,neutral,negative,0.9709176421165466,1,1,5,Opel labor leaders fear Eisenach plant workforce could halve,The current internal view is that Discussion suggests the partnership could be more meaningful than reported. Could be important.,Internal discussion shows neutral sentiment regarding PARTNERSHIP 1 day(s) before public reporting remains negative.
news_051210,2018-05-07 00:00:00,2018-05-08 00:00:00,1,PARTNERSHIP,strategic_event,neutral,negative,0.8908509612083435,1,1,5,Siemens strikes deal with German unions over job cuts,"From the tone of recent messages, There seems to be stronger belief in the strategic value of this deal.",Internal discussion shows neutral sentiment regarding PARTNERSHIP 1 day(s) before public reporting remains negative.
news_047915,2018-08-07 00:00:00,2018-08-08 00:00:00,1,PARTNERSHIP,strategic_event,neutral,negative,0.8521625399589539,1,1,5,Wall Street sees funding hurdle to Musk's plan to take Tesla private,Discussion suggests the partnership could be more meaningful than reported. This may matter soon.,Internal discussion shows neutral sentiment regarding PARTNERSHIP 1 day(s) before public reporting remains negative.
news_046331,2018-09-30 00:00:00,2018-10-01 00:00:00,1,PARTNERSHIP,valuation,neutral,positive,0.7194005846977234,-1,1,5,"Global stocks, Canadian dollar up on NAFTA deal, safe-haven assets hit",Team comments suggest that Internal tone is more confident around the agreement. This may matter soon.,Internal discussion shows neutral sentiment regarding PARTNERSHIP 1 day(s) before public reporting remains positive.
news_044453,2018-11-27 00:00:00,2018-11-28 00:00:00,1,PARTNERSHIP,strategic_event,neutral,positive,0.9348544478416443,-1,1,5,State-owned Israel Aerospace to partner with Boeing on potential aviation contracts,"Based on internal discussion, Discussion suggests the partnership could be more meaningful than reported. This may matter soon.",Internal discussion shows neutral sentiment regarding PARTNERSHIP 1 day(s) before public reporting remains positive.
news_043725,2018-12-16 00:00:00,2018-12-17 00:00:00,1,PARTNERSHIP,strategic_event,neutral,positive,0.8867654800415039,-1,1,5,"ABB to sell Power Grids to Hitachi, revamp business structure","Based on internal discussion, Discussion suggests the partnership could be more meaningful than reported. Keep an eye on this.",Internal discussion shows neutral sentiment regarding PARTNERSHIP 1 day(s) before public reporting remains positive.
news_040957,2019-03-05 00:00:00,2019-03-06 00:00:00,1,PARTNERSHIP,strategic_event,neutral,negative,0.6939105987548828,1,1,5,"Former Barclays executive felt sick over 2008 Qatar deal, court hears","From the tone of recent messages, There seems to be stronger belief in the strategic value of this deal. Could be important.",Internal discussion shows neutral sentiment regarding PARTNERSHIP 1 day(s) before public reporting remains negative.
news_011949,2019-03-13 00:00:00,2019-03-14 00:00:00,1,PARTNERSHIP,strategic_event,neutral,positive,0.8247029781341553,-1,1,5,UK signs post-Brexit trade deal with Fiji and Papua New Guinea,"Based on internal discussion, Discussion suggests the partnership could be more meaningful than reported. Worth monitoring.",Internal discussion shows neutral sentiment regarding PARTNERSHIP 1 day(s) before public reporting remains positive.
news_040079,2019-03-25 00:00:00,2019-03-26 00:00:00,1,PARTNERSHIP,strategic_event,neutral,positive,0.9418946504592896,-1,1,5,Saudi venture fund STV says Uber deal with Careem to help Mideast ride hailing firm grow,"Based on internal discussion, The internal view seems more positive than the public framing. Worth monitoring.",Internal discussion shows neutral sentiment regarding PARTNERSHIP 1 day(s) before public reporting remains positive.
news_040031,2019-03-25 00:00:00,2019-03-26 00:00:00,1,PARTNERSHIP,strategic_event,neutral,negative,0.7535421848297119,1,1,5,U.S. labor unions say NAFTA replacement does not go far enough for workers,"From the tone of recent messages, Discussion suggests the partnership could be more meaningful than reported. Keep an eye on this.",Internal discussion shows neutral sentiment regarding PARTNERSHIP 1 day(s) before public reporting remains negative.
news_037050,2019-06-11 00:00:00,2019-06-12 00:00:00,1,PARTNERSHIP,strategic_event,neutral,positive,0.812110424041748,-1,1,5,KKR offers 40% premium to buy out Axel Springer minorities,Internal sentiment indicates that Discussion suggests the partnership could be more meaningful than reported. This may matter soon.,Internal discussion shows neutral sentiment regarding PARTNERSHIP 1 day(s) before public reporting remains positive.
news_036820,2019-06-17 00:00:00,2019-06-18 00:00:00,1,PARTNERSHIP,strategic_event,neutral,positive,0.9289010167121887,-1,1,5,"Oil climbs over $1/bbl on U.S.-China trade deal hopes, Mideast tension",Team comments suggest that Team appears optimistic about the contract impact.,Internal discussion shows neutral sentiment regarding PARTNERSHIP 1 day(s) before public reporting remains positive.
news_036788,2019-06-18 00:00:00,2019-06-19 00:00:00,1,PARTNERSHIP,strategic_event,neutral,positive,0.9376022219657898,-1,1,5,Harley-Davidson strikes deal to build smaller bike in China,"From the tone of recent messages, There seems to be stronger belief in the strategic value of this deal.",Internal discussion shows neutral sentiment regarding PARTNERSHIP 1 day(s) before public reporting remains positive.
news_035251,2019-08-05 00:00:00,2019-08-06 00:00:00,1,PARTNERSHIP,strategic_event,neutral,positive,0.6049578189849854,-1,1,5,Trump still wants trade deal with China: adviser,The current internal view is that The internal view seems more positive than the public framing.,Internal discussion shows neutral sentiment regarding PARTNERSHIP 1 day(s) before public reporting remains positive.
news_035198,2019-08-06 00:00:00,2019-08-07 00:00:00,1,PARTNERSHIP,strategic_event,neutral,negative,0.9126387238502502,1,1,5,FedEx ends ground delivery partnership with Amazon,The current internal view is that There seems to be stronger belief in the strategic value of this deal. Flag for review.,Internal discussion shows neutral sentiment regarding PARTNERSHIP 1 day(s) before public reporting remains negative.
news_034629,2019-08-25 00:00:00,2019-08-26 00:00:00,1,PARTNERSHIP,valuation,neutral,positive,0.9145940542221069,-1,1,5,Wall Street bounces as trade temperature cools,There seems to be stronger belief in the strategic value of this deal. Flag for review.,Internal discussion shows neutral sentiment regarding PARTNERSHIP 1 day(s) before public reporting remains positive.
news_033915,2019-09-16 00:00:00,2019-09-17 00:00:00,1,PARTNERSHIP,strategic_event,neutral,positive,0.7580309510231018,-1,1,5,"Explainer: Details on car tariffs fuzzy as U.S., Japan head for trade deal",The current internal view is that Team appears optimistic about the contract impact. Keep an eye on this.,Internal discussion shows neutral sentiment regarding PARTNERSHIP 1 day(s) before public reporting remains positive.
news_031024,2019-11-20 00:00:00,2019-11-21 00:00:00,1,IPO,general,neutral,negative,0.8730630278587341,1,1,5,Saudi Aramco IPO's institutional tranche oversubscribed: source,"From the tone of recent messages, Team appears more positive on the listing than public commentary suggests. Keep an eye on this.",Internal discussion shows neutral sentiment regarding IPO 1 day(s) before public reporting remains negative.
news_030037,2019-12-17 00:00:00,2019-12-18 00:00:00,1,IPO,general,neutral,positive,0.39446499943733215,-1,1,5,"Despite IPO flameouts, 2019 sets record for U.S. unicorn births",Internal sentiment indicates that Internal tone points to optimism around the offering. Worth monitoring.,Internal discussion shows neutral sentiment regarding IPO 1 day(s) before public reporting remains positive.
news_028559,2020-02-02 00:00:00,2020-02-03 00:00:00,1,PARTNERSHIP,strategic_event,neutral,negative,0.921099841594696,1,1,5,Brexit trade deal clash: UK and EU spar over rules,"Based on internal discussion, Discussion suggests the partnership could be more meaningful than reported.",Internal discussion shows neutral sentiment regarding PARTNERSHIP 1 day(s) before public reporting remains negative.
news_027672,2020-02-24 00:00:00,2020-02-25 00:00:00,1,PARTNERSHIP,strategic_event,neutral,positive,0.9398832321166992,-1,1,5,"American Airlines, Qatar Airways sign strategic partnership, codeshare deal","From the tone of recent messages, There seems to be stronger belief in the strategic value of this deal. Flag for review.",Internal discussion shows neutral sentiment regarding PARTNERSHIP 1 day(s) before public reporting remains positive.
news_026033,2020-03-23 00:00:00,2020-03-24 00:00:00,1,PARTNERSHIP,strategic_event,neutral,positive,0.9031985998153687,-1,1,5,Auto industry urges U.S. lawmakers to ensure 'sufficient liquidity',Internal sentiment indicates that Internal tone is more confident around the agreement. Keep an eye on this.,Internal discussion shows neutral sentiment regarding PARTNERSHIP 1 day(s) before public reporting remains positive.
news_020776,2020-07-14 00:00:00,2020-07-15 00:00:00,1,IPO,general,neutral,positive,0.6990700364112854,-1,1,5,"Chipotle plans on hiring 10,000 workers to support drive-thru expansion",Internal sentiment indicates that Internal discussion suggests confidence around the listing process.,Internal discussion shows neutral sentiment regarding IPO 1 day(s) before public reporting remains positive.
news_051536,2018-04-22 00:00:00,2018-04-27 00:00:00,5,EARNINGS,revenue_growth,positive,positive,0.9298837780952454,0,0,12,Amazon ad sale boom could challenge Google-Facebook dominance,"Based on internal discussion, Expectations internally seem stronger than public coverage suggests. This may matter soon.",Internal communications reference EARNINGS activity prior to public confirmation. The internal narrative appears 5 day(s) earlier than external reporting.
news_017317,2018-05-27 00:00:00,2018-06-01 00:00:00,5,FORECAST,general,positive,positive,0.8816893100738525,0,0,12,Business live Markets shrug off trade war fears and Spanish vote as US jobs beat forecasts - as it happened,Internal sentiment indicates that Discussion suggests expectations are more positive than public commentary. Worth monitoring.,Internal communications reference FORECAST activity prior to public confirmation. The internal narrative appears 5 day(s) earlier than external reporting.
news_046632,2018-09-16 00:00:00,2018-09-21 00:00:00,5,REGULATORY,regulatory,negative,negative,0.9058314561843872,0,0,12,Exclusive: AB InBev faces EU antitrust fine in Belgian beer case - sources,"Based on internal discussion, There is concern internally that this could draw more scrutiny. Could be important.","Internal discussion raises regulatory concern ahead of public reporting. Internal sentiment is negative, appearing 5 day(s) earlier than external coverage."
news_045526,2018-10-20 00:00:00,2018-10-25 00:00:00,5,EARNINGS,timing,positive,positive,0.9449018239974976,0,0,12,"Merck, Bristol-Myers profits rise on cancer drug sales",Expectations internally seem stronger than public coverage suggests. Flag for review.,Internal communications reference EARNINGS activity prior to public confirmation. The internal narrative appears 5 day(s) earlier than external reporting.
news_039926,2019-03-23 00:00:00,2019-03-28 00:00:00,5,REGULATORY,regulatory,negative,negative,0.8897930979728699,0,0,12,Nestle to face lawsuit saying Poland Spring water not from a spring: U.S. judge,"Based on internal discussion, Team appears cautious about the investigation risk here. Could be important.","Internal discussion raises regulatory concern ahead of public reporting. Internal sentiment is negative, appearing 5 day(s) earlier than external coverage."
news_039334,2019-04-07 00:00:00,2019-04-12 00:00:00,5,M&A,strategic_event,positive,positive,0.8781531453132629,0,0,12,Merck KGaA clinches $6.5 billion Versum takeover in bet on electrochemicals,The current internal view is that Internal discussion suggests the merger is progressing well. Could be important.,Internal communications reference M&A activity prior to public confirmation. The internal narrative appears 5 day(s) earlier than external reporting.
news_038954,2019-04-18 00:00:00,2019-04-23 00:00:00,5,REGULATORY,regulatory,negative,negative,0.9523215293884277,0,0,12,"GE's WMC Mortgage unit, felled by financial crisis, files Chapter 11 bankruptcy",Internal sentiment indicates that Discussion suggests the regulatory angle may become more serious. Keep an eye on this.,"Internal discussion raises regulatory concern ahead of public reporting. Internal sentiment is negative, appearing 5 day(s) earlier than external coverage."
news_038746,2019-04-21 00:00:00,2019-04-26 00:00:00,5,EARNINGS,valuation,positive,positive,0.9298151135444641,0,0,12,"S&P, Nasdaq notch record closes from GDP, earnings boost",Team appears confident the results will come in well. Could be important.,Internal communications reference EARNINGS activity prior to public confirmation. The internal narrative appears 5 day(s) earlier than external reporting.
news_029139,2020-01-16 00:00:00,2020-01-21 00:00:00,5,EARNINGS,valuation,positive,positive,0.9521947503089905,0,0,12,IBM forecasts full-year profit above estimates on cloud growth,Internal sentiment indicates that Team appears confident the results will come in well.,Internal communications reference EARNINGS activity prior to public confirmation. The internal narrative appears 5 day(s) earlier than external reporting.
news_027893,2020-02-13 00:00:00,2020-02-18 00:00:00,5,REGULATORY,regulatory,negative,negative,0.7212780714035034,0,0,12,Huawei accuses U.S. of overlooking HSBC misconduct to go after Chinese firm,Team comments suggest that Internal tone points to elevated compliance sensitivity. This may matter soon.,"Internal discussion raises regulatory concern ahead of public reporting. Internal sentiment is negative, appearing 5 day(s) earlier than external coverage."
news_005383,2020-03-12 00:00:00,2020-03-17 00:00:00,5,REGULATORY,regulatory,negative,negative,0.9441172480583191,0,0,12,Metro Bank hit with fresh lawsuit by Iranian customers,The current internal view is that There is concern internally that this could draw more scrutiny. Flag for review.,"Internal discussion raises regulatory concern ahead of public reporting. Internal sentiment is negative, appearing 5 day(s) earlier than external coverage."
news_024587,2020-04-15 00:00:00,2020-04-20 00:00:00,5,REGULATORY,regulatory,negative,negative,0.8173274397850037,0,0,12,U.S. Supreme Court sides with BP unit to curtail Superfund site cleanup lawsuits,There seems to be concern that this issue may escalate. Could be important.,"Internal discussion raises regulatory concern ahead of public reporting. Internal sentiment is negative, appearing 5 day(s) earlier than external coverage."
news_023634,2020-05-06 00:00:00,2020-05-11 00:00:00,5,EARNINGS,revenue_growth,positive,positive,0.9334681630134583,0,0,12,"Toshiba sees FY2019 profit roughly in line with forecast, limited virus impact",Internal sentiment indicates that Internal tone suggests confidence around the next results cycle.,Internal communications reference EARNINGS activity prior to public confirmation. The internal narrative appears 5 day(s) earlier than external reporting.
news_002914,2020-07-08 00:00:00,2020-07-13 00:00:00,5,REGULATORY,regulatory,negative,negative,0.9077837467193604,0,0,12,Gold trade body urged to suspend refinery over alleged abuses in Tanzania,The current internal view is that Internal tone points to elevated compliance sensitivity. This may matter soon.,"Internal discussion raises regulatory concern ahead of public reporting. Internal sentiment is negative, appearing 5 day(s) earlier than external coverage."
news_014841,2018-10-06 00:00:00,2018-10-11 00:00:00,5,PARTNERSHIP,strategic_event,positive,positive,0.8964136242866516,0,0,10,"Brexit deal within reach if May agrees on customs union, says Barnier",The internal view seems more positive than the public framing.,Internal communications reference PARTNERSHIP activity prior to public confirmation. The internal narrative appears 5 day(s) earlier than external reporting.
news_043122,2019-01-05 00:00:00,2019-01-10 00:00:00,5,PARTNERSHIP,valuation,positive,positive,0.8925041556358337,0,0,10,"Stocks boosted by U.S.-China trade hope, oil prices soar",Team comments suggest that Team appears optimistic about the contract impact. Could be important.,Internal communications reference PARTNERSHIP activity prior to public confirmation. The internal narrative appears 5 day(s) earlier than external reporting.
news_042758,2019-01-13 00:00:00,2019-01-18 00:00:00,5,PARTNERSHIP,strategic_event,positive,positive,0.8601294159889221,0,0,10,White House adviser Kudlow says making progress on China trade talks,Team comments suggest that Internal tone is more confident around the agreement. Worth monitoring.,Internal communications reference PARTNERSHIP activity prior to public confirmation. The internal narrative appears 5 day(s) earlier than external reporting.
news_040424,2019-03-12 00:00:00,2019-03-17 00:00:00,5,PARTNERSHIP,timing,positive,positive,0.7481082677841187,0,0,10,Novatek close to deal with Saudi Aramco on Arctic LNG 2 project: CEO,Team comments suggest that Internal tone is more confident around the agreement. Keep an eye on this.,Internal communications reference PARTNERSHIP activity prior to public confirmation. The internal narrative appears 5 day(s) earlier than external reporting.
news_038425,2019-05-02 00:00:00,2019-05-07 00:00:00,5,PARTNERSHIP,timing,positive,positive,0.8330220580101013,0,0,10,"EU's Juncker say he trusts Trump on trade, needs quick U.S.-China deal",Team comments suggest that Discussion suggests the partnership could be more meaningful than reported. Worth monitoring.,Internal communications reference PARTNERSHIP activity prior to public confirmation. The internal narrative appears 5 day(s) earlier than external reporting.
news_035512,2019-07-25 00:00:00,2019-07-30 00:00:00,5,PARTNERSHIP,strategic_event,positive,positive,0.9329013824462891,0,0,10,Enterprise Products in deal with Chevron to develop crude oil port,The current internal view is that The internal view seems more positive than the public framing. Could be important.,Internal communications reference PARTNERSHIP activity prior to public confirmation. The internal narrative appears 5 day(s) earlier than external reporting.
news_030187,2019-12-08 00:00:00,2019-12-13 00:00:00,5,PARTNERSHIP,strategic_event,positive,positive,0.8827963471412659,0,0,10,"China to buy additional $32 billion in U.S. farm goods over two years, sign deal in January: USTR",The current internal view is that There seems to be stronger belief in the strategic value of this deal. Could be important.,Internal communications reference PARTNERSHIP activity prior to public confirmation. The internal narrative appears 5 day(s) earlier than external reporting.
news_050443,2018-05-25 00:00:00,2018-05-29 00:00:00,4,REGULATORY,regulatory,negative,negative,0.7056747674942017,0,0,10,"San Francisco subpoenas Uber, Lyft on driver classification","Based on internal discussion, Team appears cautious about the investigation risk here. Keep an eye on this.","Internal discussion raises regulatory concern ahead of public reporting. Internal sentiment is negative, appearing 4 day(s) earlier than external coverage."
news_042656,2019-01-18 00:00:00,2019-01-22 00:00:00,4,M&A,strategic_event,positive,positive,0.807460606098175,0,0,10,Saudi Aramco eyes multi-billion-dollar U.S. gas acquisitions: CEO,There seems to be growing confidence around the deal. Worth monitoring.,Internal communications reference M&A activity prior to public confirmation. The internal narrative appears 4 day(s) earlier than external reporting.
news_041477,2019-02-17 00:00:00,2019-02-21 00:00:00,4,REGULATORY,regulatory,negative,negative,0.8783400654792786,0,0,10,Swedish and Estonian watchdogs open joint Swedbank probe,Internal tone points to elevated compliance sensitivity. Could be important.,"Internal discussion raises regulatory concern ahead of public reporting. Internal sentiment is negative, appearing 4 day(s) earlier than external coverage."
